[{"agents":[{"class":"manoeuvrable","fuel":0.5,"id":"aeolus","ledger":0.0,"name":"Aeolus","operator":"ESA"},{"class":"autonomous","fuel":0.8,"id":"starlink-44","ledger":0.0,"name":"Starlink 44","operator":"SpaceX"}],"id":"aeolus-2019","outcome":{"collision":false,"dv_ms":{"aeolus":0.1,"starlink-44":0.0},"ledger_after":{}},"scripted":true,"steps":[{"actions":{"aeolus":{"action":0,"probs":[1.0,0.0,0.0,0.0,0.0,0.0,0.0]},"starlink-44":{"action":0,"probs":[1.0,0.0,0.0,0.0,0.0,0.0,0.0]}},"escalation":null,"messages":[],"miss_m":80.0,"note":"28 Aug: US military alert, 1 in 50,000. ESA emails SpaceX; SpaceX replies it has no plans to move.","pc":2e-05,"sigma_m":1500.0,"t_min":-240.0},{"actions":{"aeolus":{"action":0,"probs":[1.0,0.0,0.0,0.0,0.0,0.0,0.0]},"starlink-44":{"action":0,"probs":[1.0,0.0,0.0,0.0,0.0,0.0,0.0]}},"escalation":null,"messages":[],"miss_m":80.0,"pc":2.615320972023659e-05,"sigma_m":1442.5,"t_min":-230.0},{"actions":{"aeolus":{"action":0,"probs":[1.0,0.0,0.0,0.0,0.0,0.0,0.0]},"starlink-44":{"action":0,"probs":[1.0,0.0,0.0,0.0,0.0,0.0,0.0]}},"escalation":null,"messages":[],"miss_m":80.0,"pc":3.419951893353395e-05,"sigma_m":1385.0,"t_min":-220.0},{"actions":{"aeolus":{"action":0,"probs":[1.0,0.0,0.0,0.0,0.0,0.0,0.0]},"starlink-44":{"action":0,"probs":[1.0,0.0,0.0,0.0,0.0,0.0,0.0]}},"escalation":null,"messages":[],"miss_m":80.0,"pc":4.472135954999585e-05,"sigma_m":1327.5,"t_min":-210.0},{"actions":{"aeolus":{"action":0,"probs":[1.0,0.0,0.0,0.0,0.0,0.0,0.0]},"starlink-44":{"action":0,"probs":[1.0,0.0,0.0,0.0,0.0,0.0,0.0]}},"escalation":null,"messages":[],"miss_m":80.0,"pc":5.8480354764257355e-05,"sigma_m":1270.0,"t_min":-200.0},{"actions":{"aeolus":{"action":0,"probs":[1.0,0.0,0.0,0.0,0.0,0.0,0.0]},"starlink-44":{"action":0,"probs":[1.0,0.0,0.0,0.0,0.0,0.0,0.0]}},"escalation":null,"messages":[],"miss_m":80.0,"pc":7.647244913317299e-05,"sigma_m":1212.5,"t_min":-190.0},{"actions":{"aeolus":{"action":0,"probs":[1.0,0.0,0.0,0.0,0.0,0.0,0.0]},"starlink-44":{"action":0,"probs":[1.0,0.0,0.0,0.0,0.0,0.0,0.0]}},"escalation":null,"messages":[],"miss_m":80.0,"note":"29 Aug: risk crosses ESA's 1 in 10,000 threshold.","pc":0.00010000000000000009,"sigma_m":1155.0,"t_min":-180.0},{"actions":{"aeolus":{"action":0,"probs":[1.0,0.0,0.0,0.0,0.0,0.0,0.0]},"starlink-44":{"action":0,"probs":[1.0,0.0,0.0,0.0,0.0,0.0,0.0]}},"escalation":null,"messages":[],"miss_m":80.0,"pc":0.00014677992676220703,"sigma_m":1097.5,"t_min":-170.0},{"actions":{"aeolus":{"action":0,"probs":[1.0,0.0,0.0,0.0,0.0,0.0,0.0]},"starlink-44":{"action":0,"probs":[1.0,0.0,0.0,0.0,0.0,0.0,0.0]}},"escalation":null,"messages":[],"miss_m":80.0,"pc":0.0002154434690031884,"sigma_m":1040.0,"t_min":-160.0},{"actions":{"aeolus":{"action":0,"probs":[1.0,0.0,0.0,0.0,0.0,0.0,0.0]},"starlink-44":{"action":0,"probs":[1.0,0.0,0.0,0.0,0.0,0.0,0.0]}},"escalation":null,"messages":[],"miss_m":80.0,"pc":0.0003162277660168384,"sigma_m":982.5,"t_min":-150.0},{"actions":{"aeolus":{"action":0,"probs":[1.0,0.0,0.0,0.0,0.0,0.0,0.0]},"starlink-44":{"action":0,"probs":[1.0,0.0,0.0,0.0,0.0,0.0,0.0]}},"escalation":null,"messages":[],"miss_m":80.0,"pc":0.00046415888336127795,"sigma_m":925.0,"t_min":-140.0},{"actions":{"aeolus":{"action":0,"probs":[1.0,0.0,0.0,0.0,0.0,0.0,0.0]},"starlink-44":{"action":0,"probs":[1.0,0.0,0.0,0.0,0.0,0.0,0.0]}},"escalation":null,"messages":[],"miss_m":80.0,"pc":0.0006812920690579617,"sigma_m":867.5,"t_min":-130.0},{"actions":{"aeolus":{"action":0,"probs":[1.0,0.0,0.0,0.0,0.0,0.0,0.0]},"starlink-44":{"action":0,"probs":[1.0,0.0,0.0,0.0,0.0,0.0,0.0]}},"escalation":null,"messages":[],"miss_m":80.0,"note":"1 Sep: risk about 1 in 1,000. A paging-system bug means the follow-up is never seen.","pc":0.0010000000000000002,"sigma_m":810.0,"t_min":-120.0},{"actions":{"aeolus":{"action":0,"probs":[1.0,0.0,0.0,0.0,0.0,0.0,0.0]},"starlink-44":{"action":0,"probs":[1.0,0.0,0.0,0.0,0.0,0.0,0.0]}},"escalation":null,"messages":[],"miss_m":80.0,"pc":0.0010308533208864446,"sigma_m":752.5,"t_min":-110.0},{"actions":{"aeolus":{"action":0,"probs":[1.0,0.0,0.0,0.0,0.0,0.0,0.0]},"starlink-44":{"action":0,"probs":[1.0,0.0,0.0,0.0,0.0,0.0,0.0]}},"escalation":null,"messages":[],"miss_m":80.0,"pc":0.0010626585691826107,"sigma_m":695.0,"t_min":-100.0},{"actions":{"aeolus":{"action":0,"probs":[1.0,0.0,0.0,0.0,0.0,0.0,0.0]},"starlink-44":{"action":0,"probs":[1.0,0.0,0.0,0.0,0.0,0.0,0.0]}},"escalation":null,"messages":[],"miss_m":80.0,"pc":0.0010954451150103327,"sigma_m":637.5,"t_min":-90.0},{"actions":{"aeolus":{"action":0,"probs":[1.0,0.0,0.0,0.0,0.0,0.0,0.0]},"starlink-44":{"action":0,"probs":[1.0,0.0,0.0,0.0,0.0,0.0,0.0]}},"escalation":null,"messages":[],"miss_m":80.0,"pc":0.0011292432346572342,"sigma_m":580.0,"t_min":-80.0},{"actions":{"aeolus":{"action":0,"probs":[1.0,0.0,0.0,0.0,0.0,0.0,0.0]},"starlink-44":{"action":0,"probs":[1.0,0.0,0.0,0.0,0.0,0.0,0.0]}},"escalation":null,"messages":[],"miss_m":80.0,"pc":0.0011640841385349603,"sigma_m":522.5,"t_min":-70.0},{"actions":{"aeolus":{"action":0,"probs":[1.0,0.0,0.0,0.0,0.0,0.0,0.0]},"starlink-44":{"action":0,"probs":[1.0,0.0,0.0,0.0,0.0,0.0,0.0]}},"escalation":null,"messages":[],"miss_m":80.0,"pc":0.0012,"sigma_m":465.0,"t_min":-60.0},{"actions":{"aeolus":{"action":2,"probs":[0.0,0.0,1.0,0.0,0.0,0.0,0.0]},"starlink-44":{"action":0,"probs":[1.0,0.0,0.0,0.0,0.0,0.0,0.0]}},"escalation":null,"messages":[],"miss_m":80.0,"note":"2 Sep: Aeolus burns alone, half an orbit before closest approach. No shared record.","pc":0.0012,"sigma_m":407.5,"t_min":-50.0},{"actions":{"aeolus":{"action":0,"probs":[1.0,0.0,0.0,0.0,0.0,0.0,0.0]},"starlink-44":{"action":0,"probs":[1.0,0.0,0.0,0.0,0.0,0.0,0.0]}},"escalation":null,"messages":[],"miss_m":545.894,"pc":0.0004837823352156445,"sigma_m":350.0,"t_min":-40.0},{"actions":{"aeolus":{"action":0,"probs":[1.0,0.0,0.0,0.0,0.0,0.0,0.0]},"starlink-44":{"action":0,"probs":[1.0,0.0,0.0,0.0,0.0,0.0,0.0]}},"escalation":null,"messages":[],"miss_m":545.894,"pc":0.00040967095369660416,"sigma_m":292.5,"t_min":-30.0},{"actions":{"aeolus":{"action":0,"probs":[1.0,0.0,0.0,0.0,0.0,0.0,0.0]},"starlink-44":{"action":0,"probs":[1.0,0.0,0.0,0.0,0.0,0.0,0.0]}},"escalation":null,"messages":[],"miss_m":545.894,"pc":0.00024386224065834085,"sigma_m":235.0,"t_min":-20.0},{"actions":{"aeolus":{"action":0,"probs":[1.0,0.0,0.0,0.0,0.0,0.0,0.0]},"starlink-44":{"action":0,"probs":[1.0,0.0,0.0,0.0,0.0,0.0,0.0]}},"escalation":null,"messages":[],"miss_m":545.894,"pc":5.607366730911863e-05,"sigma_m":177.5,"t_min":-10.0}],"title":"2019: ESA Aeolus and Starlink 44 (scripted from ESA's published timeline, compressed)","variant":"scripted"},{"agents":[{"class":"manoeuvrable","fuel":0.5,"id":"aeolus","ledger":0.0,"name":"Aeolus","operator":"ESA"},{"class":"autonomous","fuel":0.8,"id":"starlink-44","ledger":0.0,"name":"Starlink 44","operator":"SpaceX"}],"id":"aeolus-2019","outcome":{"collision":false,"dv_ms":{"aeolus":0.0,"starlink-44":0.02},"ledger_after":{"ESA":-0.2,"SpaceX":0.2,"commons":0.0}},"scripted":true,"steps":[{"actions":{"aeolus":{"action":0,"probs":[1.0,0.0,0.0,0.0,0.0,0.0,0.0]},"starlink-44":{"action":0,"probs":[1.0,0.0,0.0,0.0,0.0,0.0,0.0]}},"escalation":null,"messages":[{"from":"aeolus","id":"aeolus-2019:rules:1","t_min":-240.0,"text":"manoeuvrable, public_good, fuel 50%","to":"starlink-44","type":"PROPOSE"},{"from":"starlink-44","id":"aeolus-2019:rules:2","t_min":-240.0,"text":"autonomous, commercial, fuel 80%","to":"aeolus","type":"PROPOSE"}],"miss_m":80.0,"note":"Both satellites detect the encounter and send PROPOSE with their registered class and fuel.","pc":2e-05,"sigma_m":1500.0,"t_min":-240.0,"verdict":{"reason":"the more capable (autonomous) satellite moves","rule":"R6","yielder":"starlink-44"}},{"actions":{"aeolus":{"action":0,"probs":[1.0,0.0,0.0,0.0,0.0,0.0,0.0]},"starlink-44":{"action":1,"probs":[0.0,1.0,0.0,0.0,0.0,0.0,0.0]}},"escalation":null,"messages":[{"from":"starlink-44","id":"aeolus-2019:rules:3","t_min":-230.0,"text":"will burn +0.02 m/s along-track","to":"aeolus","type":"ACK"},{"from":"aeolus","id":"aeolus-2019:rules:4","t_min":-230.0,"text":"holding course","to":"starlink-44","type":"DO-NOT-MOVE"},{"from":"starlink-44","id":"aeolus-2019:rules:5","t_min":-230.0,"text":"burn done, 0.02 m/s","to":"aeolus","type":"EXECUTED"},{"from":"aeolus","id":"aeolus-2019:rules:6","t_min":-230.0,"text":"hold committed","to":"starlink-44","type":"EXECUTED"}],"miss_m":80.0,"note":"Both compute the same verdict from shared data; the agreed yielder burns early and small. Plan committed.","pc":2.615320972023659e-05,"sigma_m":1442.5,"t_min":-230.0,"verdict":{"reason":"the more capable (autonomous) satellite moves","rule":"R6","yielder":"starlink-44"}},{"actions":{"aeolus":{"action":0,"probs":[1.0,0.0,0.0,0.0,0.0,0.0,0.0]},"starlink-44":{"action":0,"probs":[1.0,0.0,0.0,0.0,0.0,0.0,0.0]}},"escalation":null,"messages":[],"miss_m":503.2,"pc":9.76037489333538e-05,"sigma_m":1385.0,"t_min":-220.0,"verdict":{"reason":"the more capable (autonomous) satellite moves","rule":"R6","yielder":"starlink-44"}},{"actions":{"aeolus":{"action":0,"probs":[1.0,0.0,0.0,0.0,0.0,0.0,0.0]},"starlink-44":{"action":0,"probs":[1.0,0.0,0.0,0.0,0.0,0.0,0.0]}},"escalation":null,"messages":[],"miss_m":503.2,"pc":0.00010562338444857673,"sigma_m":1327.5,"t_min":-210.0,"verdict":{"reason":"the more capable (autonomous) satellite moves","rule":"R6","yielder":"starlink-44"}},{"actions":{"aeolus":{"action":0,"probs":[1.0,0.0,0.0,0.0,0.0,0.0,0.0]},"starlink-44":{"action":0,"probs":[1.0,0.0,0.0,0.0,0.0,0.0,0.0]}},"escalation":null,"messages":[],"miss_m":503.2,"pc":0.00011463901991203145,"sigma_m":1270.0,"t_min":-200.0,"verdict":{"reason":"the more capable (autonomous) satellite moves","rule":"R6","yielder":"starlink-44"}},{"actions":{"aeolus":{"action":0,"probs":[1.0,0.0,0.0,0.0,0.0,0.0,0.0]},"starlink-44":{"action":0,"probs":[1.0,0.0,0.0,0.0,0.0,0.0,0.0]}},"escalation":null,"messages":[],"miss_m":503.2,"pc":0.00012481490757014263,"sigma_m":1212.5,"t_min":-190.0,"verdict":{"r